{
  "$schema": "https://json-schema.org/draft/2020-12/schema",
  "$id": "https://game.example.com/schemas/evo/trait.schema.json",
  "title": "Evo Tactics Trait",
  "type": "object",
  "additionalProperties": false,
  "required": ["trait_code", "label", "tier", "metrics"],
  "properties": {
    "trait_code": {
      "type": "string",
      "pattern": "^TR-\\d{4}$"
    },
    "id": {
      "type": "string",
      "pattern": "^[a-z0-9]+(?:_[a-z0-9]+)*$"
    },
    "label": {
      "type": "string",
      "minLength": 1
    },
    "famiglia_tipologia": {
      "type": "string"
    },
    "fattore_mantenimento_energetico": {
      "$ref": "enums.json#/$defs/energy_upkeep_level"
    },
    "tier": {
      "$ref": "enums.json#/$defs/sentience_tier"
    },
    "slot": {
      "type": "array",
      "items": {
        "type": "string",
        "pattern": "^[A-Z]$"
      },
      "uniqueItems": true
    },
    "sinergie": {
      "type": "array",
      "items": {
        "type": "string",
        "pattern": "^[a-z0-9]+(?:_[a-z0-9]+)*$"
      },
      "uniqueItems": true
    },
    "conflitti": {
      "type": "array",
      "items": {
        "type": "string",
        "pattern": "^[a-z0-9]+(?:_[a-z0-9]+)*$"
      },
      "uniqueItems": true
    },
    "requisiti_ambientali": {
      "type": "array",
      "items": {
        "type": "object",
        "additionalProperties": false,
        "required": ["condizioni", "fonte", "meta"],
        "properties": {
          "capacita_richieste": {
            "type": "array",
            "items": {
              "type": "string",
              "minLength": 1
            }
          },
          "condizioni": {
            "type": "object",
            "additionalProperties": false,
            "required": ["biome_class"],
            "properties": {
              "biome_class": {
                "type": "string",
                "minLength": 1
              }
            }
          },
          "fonte": {
            "type": "string",
            "minLength": 1
          },
          "meta": {
            "type": "object",
            "additionalProperties": false,
            "properties": {
              "tier": {
                "$ref": "enums.json#/$defs/sentience_tier"
              },
              "notes": {
                "type": "string"
              }
            }
          }
        }
      }
    },
    "mutazione_indotta": {
      "type": "string"
    },
    "uso_funzione": {
      "type": "string"
    },
    "spinta_selettiva": {
      "type": "string"
    },
    "metrics": {
      "type": "array",
      "items": {
        "type": "object",
        "additionalProperties": false,
        "required": ["name", "value", "unit"],
        "properties": {
          "name": {
            "type": "string",
            "minLength": 1
          },
          "value": {
            "type": "number"
          },
          "unit": {
            "$ref": "enums.json#/$defs/metric_unit"
          },
          "conditions": {
            "type": "string"
          }
        }
      },
      "minItems": 1
    },
    "cost_profile": {
      "type": "object",
      "additionalProperties": false,
      "properties": {
        "rest": {
          "type": "string"
        },
        "burst": {
          "type": "string"
        },
        "sustained": {
          "type": "string"
        }
      }
    },
    "testability": {
      "type": "object",
      "additionalProperties": false,
      "properties": {
        "observable": {
          "type": "string"
        },
        "scene_prompt": {
          "type": "string"
        }
      }
    },
    "applicability": {
      "type": "object",
      "additionalProperties": false,
      "properties": {
        "clades": {
          "type": "array",
          "items": {
            "type": "string",
            "minLength": 1
          }
        },
        "envo_terms": {
          "type": "array",
          "items": {
            "type": "string",
            "pattern": "^http://purl\\.obolibrary\\.org/obo/ENVO_\\d+$"
          }
        },
        "notes": {
          "type": "string"
        }
      }
    },
    "version": {
      "type": "string",
      "pattern": "^(0|[1-9]\\d*)\\.(0|[1-9]\\d*)\\.(0|[1-9]\\d*)(?:-[0-9A-Za-z-.]+)?(?:\\+[0-9A-Za-z-.]+)?$"
    },
    "versioning": {
      "type": "object",
      "additionalProperties": false,
      "required": ["created", "updated", "author"],
      "properties": {
        "created": {
          "type": "string",
          "format": "date"
        },
        "updated": {
          "type": "string",
          "format": "date"
        },
        "author": {
          "type": "string",
          "minLength": 1
        },
        "status": {
          "type": "string"
        }
      }
    }
  }
}
