{
  "trait_code": "TR-1703",
  "id": "campo_di_interferenza_acustica",
  "label": "Campo di Interferenza Acustica",
  "famiglia_tipologia": "Difensivo/Camuffamento",
  "fattore_mantenimento_energetico": "Basso",
  "tier": "T3",
  "slot": [],
  "sinergie": [
    "TR-1701"
  ],
  "conflitti": [],
  "requisiti_ambientali": [
    {
      "capacita_richieste": [],
      "condizioni": {
        "biome_class": "terrestre"
      },
      "fonte": "envo_mapping",
      "meta": {
        "tier": "T3",
        "notes": ""
      }
    }
  ],
  "mutazione_indotta": "Rumore bianco caotico a fase variabile.",
  "uso_funzione": "Mascherare posizione/velocit√†.",
  "spinta_selettiva": "Evasione da pipistrelli/rapaci.",
  "metrics": [
    {
      "name": "spl_riduzione",
      "value": 18,
      "unit": "dB"
    }
  ],
  "cost_profile": {
    "rest": "Basso",
    "burst": "Medio",
    "sustained": "Basso"
  },
  "testability": {
    "observable": "Interferisce con ecolocalizzazione",
    "scene_prompt": "Test radar acustico in galleria del vento"
  },
  "applicability": {
    "clades": [],
    "envo_terms": [
      "http://purl.obolibrary.org/obo/ENVO_01000178"
    ]
  },
  "version": "2.0.1",
  "versioning": {
    "created": "2025-11-04",
    "updated": "2025-11-22",
    "author": "GPT-5.1-Codex-Max"
  }
}
