{
  "trait_code": "TR-1205",
  "id": "rostro_linguale_prensile",
  "label": "Rostro Linguale Prensile",
  "famiglia_tipologia": "Manipolativo/Alimentare",
  "fattore_mantenimento_energetico": "Medio",
  "tier": "T3",
  "slot": [],
  "sinergie": [
    "TR-1204"
  ],
  "conflitti": [],
  "requisiti_ambientali": [
    {
      "capacita_richieste": [],
      "condizioni": {
        "biome_class": "terrestre"
      },
      "fonte": "envo_mapping",
      "meta": {
        "tier": "T3",
        "notes": ""
      }
    }
  ],
  "mutazione_indotta": "Lingua muscolare adesiva con ioide esteso.",
  "uso_funzione": "Afferrrare/manipolare a lungo raggio",
  "spinta_selettiva": "Accesso a risorse in cavità/altezza senza muovere il corpo",
  "metrics": [
    {
      "name": "lunghezza_estensione",
      "value": 2.0,
      "unit": "m"
    }
  ],
  "cost_profile": {
    "rest": "Basso",
    "burst": "Medio",
    "sustained": "Basso"
  },
  "testability": {
    "observable": "Estrae oggetto a 2 m in 3 s",
    "scene_prompt": "Recupero uovo da cavità senza frattura"
  },
  "applicability": {
    "clades": [],
    "envo_terms": [
      "http://purl.obolibrary.org/obo/ENVO_01000228"
    ]
  },
  "version": "2.0.0",
  "versioning": {
    "created": "2025-11-04",
    "updated": "2025-11-04",
    "author": "Master DD / GPT-5 Pro"
  }
}
